{
  "schema_version": "experiment-casebook-v1",
  "generated_at": "2026-07-17T11:45:00+05:30",
  "audit_id": "sip-deep-2026-07-13",
  "status": "designed_not_executed",
  "description": "Machine-readable experiment casebook derived from the comparative 5+5 discovery pack. All cases are design-only. No contacts have been made. No experiments have been executed.",
  "source_pack": ".positioning-audit/comparative-5plus5-discovery-pack-2026-07-17.json",
  "experiment_refs": ["EXP-007", "EXP-008"],
  "rules": {
    "no_private_contact_data": true,
    "no_outreach_executed": true,
    "no_experiment_status_changes": true,
    "experiments_executed_remains_0": true,
    "hypothesis_transition_remains_unresolved": true,
    "education_lane_complementary_to_moblab": true,
    "moblab_url": "https://www.moblab.com/products/classroom"
  },
  "cases": [
    {
      "case_id": "CASE-ENT-001",
      "experiment_id": "EXP-008",
      "hypothesis_id": "H-ENT-0",
      "lane": "enterprise",
      "target_organization": "GAO Center for Strategic Foresight",
      "target_role": "Strategic foresight director or federal program-analysis lead",
      "public_source_url": "https://www.gao.gov/about/what-gao-does/audit-role/csf/",
      "job_to_be_tested": "Moving from source material to a decision-ready brief with evidence, review, and governance steps",
      "demo_surface": "Console to strategist brief to human-review and forecast-draft handoff",
      "discovery_questions": [
        "Where does GAO Center for Strategic Foresight currently lose time or confidence moving from source material to a decision-ready brief?",
        "Which evidence, review, or governance step is mandatory before a forecast or scenario recommendation is trusted?",
        "What proof would you need from a guided pilot before sponsoring a broader evaluation?",
        "Which existing tool, analyst workflow, consultancy, or spreadsheet would this need to complement or replace?",
        "If the workflow helped, what concrete next step would be credible: second review, internal demo, paid pilot, LOI, or no action?"
      ],
      "required_evidence_fields": [
        "buyer_role", "proof_shown", "objection", "next_action",
        "willingness_to_pay_signal", "baseline_value_or_current_workflow",
        "pilot_outcome_value_or_expected_delta", "quality_signal",
        "buyer_decision_event", "outcome_evidence_notes"
      ],
      "consent_requirement": "Explicit verbal consent before recording any notes; public-sector confidentiality boundaries apply",
      "stop_failure_rule": "Stop if target declines consent, requests written materials only, or indicates no recurring unmet job",
      "status": "designed_not_executed",
      "contact_status": "not_contacted"
    },
    {
      "case_id": "CASE-ENT-002",
      "experiment_id": "EXP-008",
      "hypothesis_id": "H-ENT-0",
      "lane": "enterprise",
      "target_organization": "UK Government Office for Science Futures and Foresight",
      "target_role": "Futures, foresight, or horizon-scanning team lead",
      "public_source_url": "https://www.gov.uk/government/groups/futures-and-foresight",
      "job_to_be_tested": "Moving from horizon-scanning sources to a decision-ready foresight brief with governance",
      "demo_surface": "Actor/countermove brief plus review state and forecast-governance caveats",
      "discovery_questions": [
        "Where does UK Government Office for Science Futures and Foresight currently lose time or confidence moving from source material to a decision-ready brief?",
        "Which evidence, review, or governance step is mandatory before a forecast or scenario recommendation is trusted?",
        "What proof would you need from a guided pilot before sponsoring a broader evaluation?",
        "Which existing tool, analyst workflow, consultancy, or spreadsheet would this need to complement or replace?",
        "If the workflow helped, what concrete next step would be credible: second review, internal demo, paid pilot, LOI, or no action?"
      ],
      "required_evidence_fields": [
        "buyer_role", "proof_shown", "objection", "next_action",
        "willingness_to_pay_signal", "baseline_value_or_current_workflow",
        "pilot_outcome_value_or_expected_delta", "quality_signal",
        "buyer_decision_event", "outcome_evidence_notes"
      ],
      "consent_requirement": "Explicit verbal consent; UK government communication standards apply",
      "stop_failure_rule": "Stop if target declines consent or indicates no recurring unmet job",
      "status": "designed_not_executed",
      "contact_status": "not_contacted"
    },
    {
      "case_id": "CASE-ENT-003",
      "experiment_id": "EXP-008",
      "hypothesis_id": "H-ENT-0",
      "lane": "enterprise",
      "target_organization": "OECD Strategic Foresight Unit / Government Foresight Community",
      "target_role": "Strategic foresight unit lead or GFC program contact",
      "public_source_url": "https://www.oecd.org/strategic-foresight/",
      "job_to_be_tested": "Moving from evidence-based foresight inputs to anticipatory policy recommendations",
      "demo_surface": "Public-sector scenario brief with transparent uncertainty and policy trade-off questions",
      "discovery_questions": [
        "Where does OECD Strategic Foresight Unit currently lose time or confidence moving from source material to a decision-ready brief?",
        "Which evidence, review, or governance step is mandatory before a forecast or scenario recommendation is trusted?",
        "What proof would you need from a guided pilot before sponsoring a broader evaluation?",
        "Which existing tool, analyst workflow, consultancy, or spreadsheet would this need to complement or replace?",
        "If the workflow helped, what concrete next step would be credible: second review, internal demo, paid pilot, LOI, or no action?"
      ],
      "required_evidence_fields": [
        "buyer_role", "proof_shown", "objection", "next_action",
        "willingness_to_pay_signal", "baseline_value_or_current_workflow",
        "pilot_outcome_value_or_expected_delta", "quality_signal",
        "buyer_decision_event", "outcome_evidence_notes"
      ],
      "consent_requirement": "Explicit verbal consent; OECD institutional communication protocols apply",
      "stop_failure_rule": "Stop if target declines consent or indicates no recurring unmet job",
      "status": "designed_not_executed",
      "contact_status": "not_contacted"
    },
    {
      "case_id": "CASE-ENT-004",
      "experiment_id": "EXP-008",
      "hypothesis_id": "H-ENT-0",
      "lane": "enterprise",
      "target_organization": "Policy Horizons Canada",
      "target_role": "Foresight analyst or policy innovation lead",
      "public_source_url": "https://horizons.service.canada.ca/en/home/index.shtml",
      "job_to_be_tested": "Moving from foresight inputs to policy recommendations under uncertainty",
      "demo_surface": "Evidence bundle and audience-specific briefing for a policy uncertainty",
      "discovery_questions": [
        "Where does Policy Horizons Canada currently lose time or confidence moving from source material to a decision-ready brief?",
        "Which evidence, review, or governance step is mandatory before a forecast or scenario recommendation is trusted?",
        "What proof would you need from a guided pilot before sponsoring a broader evaluation?",
        "Which existing tool, analyst workflow, consultancy, or spreadsheet would this need to complement or replace?",
        "If the workflow helped, what concrete next step would be credible: second review, internal demo, paid pilot, LOI, or no action?"
      ],
      "required_evidence_fields": [
        "buyer_role", "proof_shown", "objection", "next_action",
        "willingness_to_pay_signal", "baseline_value_or_current_workflow",
        "pilot_outcome_value_or_expected_delta", "quality_signal",
        "buyer_decision_event", "outcome_evidence_notes"
      ],
      "consent_requirement": "Explicit verbal consent; Government of Canada communication standards apply",
      "stop_failure_rule": "Stop if target declines consent or indicates no recurring unmet job",
      "status": "designed_not_executed",
      "contact_status": "not_contacted"
    },
    {
      "case_id": "CASE-ENT-005",
      "experiment_id": "EXP-008",
      "hypothesis_id": "H-ENT-0",
      "lane": "enterprise",
      "target_organization": "Atlantic Council GeoStrategy Initiative",
      "target_role": "Foresight, strategy, or program lead",
      "public_source_url": "https://www.atlanticcouncil.org/our-programs/foresight-strategy-and-risks-initiative/",
      "job_to_be_tested": "Producing global foresight and long-range strategy work for complex international issues",
      "demo_surface": "Analyst briefing layer plus forecast-draft governance for a Global Foresight scenario",
      "discovery_questions": [
        "Where does Atlantic Council GeoStrategy Initiative currently lose time or confidence moving from source material to a decision-ready brief?",
        "Which evidence, review, or governance step is mandatory before a forecast or scenario recommendation is trusted?",
        "What proof would you need from a guided pilot before sponsoring a broader evaluation?",
        "Which existing tool, analyst workflow, consultancy, or spreadsheet would this need to complement or replace?",
        "If the workflow helped, what concrete next step would be credible: second review, internal demo, paid pilot, LOI, or no action?"
      ],
      "required_evidence_fields": [
        "buyer_role", "proof_shown", "objection", "next_action",
        "willingness_to_pay_signal", "baseline_value_or_current_workflow",
        "pilot_outcome_value_or_expected_delta", "quality_signal",
        "buyer_decision_event", "outcome_evidence_notes"
      ],